organization_id,category_id,name,description,info,created,created_by,updated,updated_by,active
99614fa2-29fd-4d5f-95bc-06964d78d672,3b6da08e-ba56-44c1-9930-00d084576355,Lotstring,,"Maecenas leo odio, condimentum id, luctus nec, molestie sed, justo. Pellentesque viverra pede ac diam. Cras pellentesque volutpat dui.",12/21/2015,5a38ef87-3343-4d39-8a2c-8ea8042b58c7,,,true
7618486b-2511-4efc-9ef6-426ffc3a393c,26f80174-43b4-47ef-8a59-19795a078903,Temp,"Pellentesque ultrices mattis odio. Donec vitae nisi. Nam ultrices, libero non mattis pulvinar, nulla pede ullamcorper augue, a suscipit nulla elit ac nulla. Sed vel enim sit amet nunc viverra dapibus.","Sed ante. Vivamus tortor. Duis mattis egestas metus.

Aenean fermentum. Donec ut mauris eget massa tempor convallis. Nulla neque libero, convallis eget, eleifend luctus, ultricies eu, nibh.

Curabitur gravida nisi at nibh. In hac habitasse platea dictumst. Aliquam augue quam, sollicitudin vitae, consectetuer eget, rutrum at, lorem.

Integer tincidunt ante vel ipsum. Praesent blandit lacinia erat. Vestibulum sed magna at nunc commodo placerat.",2/1/2016,3da46741-6ab9-47a8-ab22-8bc8aafd204d,,,true
0441df18-5719-4390-8550-43da477746a9,8c1699ac-2d2e-4128-936d-c447d7f77cbb,Cookley,Mauris lacinia sapien quis libero. Nullam sit amet turpis elementum ligula vehicula consequat. Morbi a ipsum. Integer a nibh. In quis justo. Maecenas rhoncus aliquam lacus.,Suspendisse potenti. In eleifend quam a odio. In hac habitasse platea dictumst.,8/20/2015,5e85a8b2-29f6-476c-ade7-d6b3b61a31d9,,,false
cce157d5-0685-4aac-8c89-d13e30a78609,e0791417-9f1a-4909-9915-a02e8002d65b,Stronghold,"Aenean lectus. Pellentesque eget nunc. Donec quis orci eget orci vehicula condimentum. Curabitur in libero ut massa volutpat convallis. Morbi odio odio, elementum eu, interdum eu, tincidunt in, leo. Maecenas pulvinar lobortis est. Phasellus sit amet erat.","Sed sagittis. Nam congue, risus semper porta volutpat, quam pede lobortis ligula, sit amet eleifend pede libero quis orci. Nullam molestie nibh in lectus.

Pellentesque at nulla. Suspendisse potenti. Cras in purus eu magna vulputate luctus.

Cum sociis natoque penatibus et magnis dis parturient montes, nascetur ridiculus mus. Vivamus vestibulum sagittis sapien. Cum sociis natoque penatibus et magnis dis parturient montes, nascetur ridiculus mus.",8/4/2015,c2e773d8-6cbc-4306-8a5f-c273889e318a,,,true
4bfc91eb-a206-4df9-b598-5ade5ed625e9,d0854743-acec-42dc-8ad7-4801bafa729d,Kanlam,,"Morbi non lectus. Aliquam sit amet diam in magna bibendum imperdiet. Nullam orci pede, venenatis non, sodales sed, tincidunt eu, felis.",5/22/2016,1645be21-9e86-4178-a297-347e3effe8e5,,,true
b77b3315-49ce-4fb8-bf4b-3659a352f61f,6933121c-69dc-47be-aff2-a0762b81d451,Zoolab,"Donec ut dolor. Morbi vel lectus in quam fringilla rhoncus. Mauris enim leo, rhoncus sed, vestibulum sit amet, cursus id, turpis. Integer aliquet, massa id lobortis convallis, tortor risus dapibus augue, vel accumsan tellus nisi eu orci. Mauris lacinia sapien quis libero.","Praesent id massa id nisl venenatis lacinia. Aenean sit amet justo. Morbi ut odio.

Cras mi pede, malesuada in, imperdiet et, commodo vulputate, justo. In blandit ultrices enim. Lorem ipsum dolor sit amet, consectetuer adipiscing elit.",9/2/2015,bf2da4ec-826d-4570-9591-4ee95afae615,,,true
9bac013d-6189-47f1-9e8c-5f72dcf5d31b,24aced1a-4388-43fc-9f80-e1596f805e50,Regrant,,"Nullam sit amet turpis elementum ligula vehicula consequat. Morbi a ipsum. Integer a nibh.

In quis justo. Maecenas rhoncus aliquam lacus. Morbi quis tortor id nulla ultrices aliquet.",8/24/2015,5d820438-b6a8-4fed-b2cf-b1037559dd91,,,false
677f872d-cca2-4f84-a8f9-09b5a93ee436,96713995-3efa-43e5-b910-48a2d1273e1b,Gembucket,"Duis aliquam convallis nunc. Proin at turpis a pede posuere nonummy. Integer non velit. Donec diam neque, vestibulum eget, vulputate ut, ultrices vel, augue.","Vestibulum ac est lacinia nisi venenatis tristique. Fusce congue, diam id ornare imperdiet, sapien urna pretium nisl, ut volutpat sapien arcu sed augue. Aliquam erat volutpat.

In congue. Etiam justo. Etiam pretium iaculis justo.",6/9/2016,f1c9b953-998e-4e7e-87cf-60fde1541ebf,,,true
aff779d1-46cd-419d-a195-5bb531942203,0c0a2f66-a936-4741-bbe2-f43ad794e040,Y-find,"Morbi vel lectus in quam fringilla rhoncus. Mauris enim leo, rhoncus sed, vestibulum sit amet, cursus id, turpis. Integer aliquet, massa id lobortis convallis, tortor risus dapibus augue, vel accumsan tellus nisi eu orci. Mauris lacinia sapien quis libero. Nullam sit amet turpis elementum ligula vehicula consequat. Morbi a ipsum. Integer a nibh.","Sed sagittis. Nam congue, risus semper porta volutpat, quam pede lobortis ligula, sit amet eleifend pede libero quis orci. Nullam molestie nibh in lectus.

Pellentesque at nulla. Suspendisse potenti. Cras in purus eu magna vulputate luctus.",7/27/2015,b5af6d97-5010-4c75-b25e-d93f34aff194,,,false
683a44d0-5ca6-455d-965a-9a22661b71fc,42a7049c-17eb-4a35-b4d4-c0f562fff223,Konklab,Etiam justo. Etiam pretium iaculis justo. In hac habitasse platea dictumst.,"Etiam vel augue. Vestibulum rutrum rutrum neque. Aenean auctor gravida sem.

Praesent id massa id nisl venenatis lacinia. Aenean sit amet justo. Morbi ut odio.

Cras mi pede, malesuada in, imperdiet et, commodo vulputate, justo. In blandit ultrices enim. Lorem ipsum dolor sit amet, consectetuer adipiscing elit.",6/12/2016,3b22acf0-923c-4d24-87ef-e32b6ad184be,,,true
c411d2d2-0f1c-4d61-a3dd-11a392bba6f0,9bd673f2-1f8b-4a69-957b-2e135b5de64f,Prodder,Sed ante. Vivamus tortor.,"Duis bibendum, felis sed interdum venenatis, turpis enim blandit mi, in porttitor pede justo eu massa. Donec dapibus. Duis at velit eu est congue elementum.

In hac habitasse platea dictumst. Morbi vestibulum, velit id pretium iaculis, diam erat fermentum justo, nec condimentum neque sapien placerat ante. Nulla justo.

Aliquam quis turpis eget elit sodales scelerisque. Mauris sit amet eros. Suspendisse accumsan tortor quis turpis.",2/4/2016,6cde518b-e4e1-4e29-9df5-33732b9431f4,,,true
ac65af5c-7828-43b7-ae5b-7166e517c386,cb779c58-4538-4efd-aefe-efd63f98a1b4,Stim,"Aliquam non mauris. Morbi non lectus. Aliquam sit amet diam in magna bibendum imperdiet. Nullam orci pede, venenatis non, sodales sed, tincidunt eu, felis. Fusce posuere felis sed lacus. Morbi sem mauris, laoreet ut, rhoncus aliquet, pulvinar sed, nisl. Nunc rhoncus dui vel sem. Sed sagittis.",Duis bibendum. Morbi non quam nec dui luctus rutrum. Nulla tellus.,9/5/2015,a1645855-9640-4906-85e5-c2cdb625a152,,,true
39bc2393-b755-45d0-b6cb-cdadd6973e30,2a1a8d1d-8123-49ae-8adc-34318b7d4f5e,Transcof,Mauris lacinia sapien quis libero.,"Cum sociis natoque penatibus et magnis dis parturient montes, nascetur ridiculus mus. Vivamus vestibulum sagittis sapien. Cum sociis natoque penatibus et magnis dis parturient montes, nascetur ridiculus mus.

Etiam vel augue. Vestibulum rutrum rutrum neque. Aenean auctor gravida sem.

Praesent id massa id nisl venenatis lacinia. Aenean sit amet justo. Morbi ut odio.",3/5/2016,2227f3d5-ce44-4ea2-82f6-071d163d8648,,,true
b22bbfd4-063b-4e9c-9fa5-42a9256ea634,0c56f782-c900-4335-81d8-78197e611041,Overhold,,"In congue. Etiam justo. Etiam pretium iaculis justo.

In hac habitasse platea dictumst. Etiam faucibus cursus urna. Ut tellus.",1/26/2016,f2c3efa1-c8ab-4415-b30f-4edec8157373,,,false
4b24573e-bcdd-48c1-b614-0437a001abdc,700acc29-9651-4a7c-a0b4-1a1fb07e93a9,Fixflex,"Quisque id justo sit amet sapien dignissim vestibulum. Vestibulum ante ipsum primis in faucibus orci luctus et ultrices posuere cubilia Curae; Nulla dapibus dolor vel est. Donec odio justo, sollicitudin ut, suscipit a, feugiat et, eros. Vestibulum ac est lacinia nisi venenatis tristique.","In sagittis dui vel nisl. Duis ac nibh. Fusce lacus purus, aliquet at, feugiat non, pretium quis, lectus.

Suspendisse potenti. In eleifend quam a odio. In hac habitasse platea dictumst.",11/17/2015,e0052c5a-3ab1-4235-bb6e-5b3985af1023,,,true
a1a67ce7-5769-4c08-a8ff-676fb418bf50,952cfb6b-82db-4895-8072-1d949662f99d,Bigtax,"Vestibulum ante ipsum primis in faucibus orci luctus et ultrices posuere cubilia Curae; Donec pharetra, magna vestibulum aliquet ultrices, erat tortor sollicitudin mi, sit amet lobortis sapien sapien non mi. Integer ac neque. Duis bibendum. Morbi non quam nec dui luctus rutrum. Nulla tellus. In sagittis dui vel nisl. Duis ac nibh. Fusce lacus purus, aliquet at, feugiat non, pretium quis, lectus. Suspendisse potenti.","In hac habitasse platea dictumst. Morbi vestibulum, velit id pretium iaculis, diam erat fermentum justo, nec condimentum neque sapien placerat ante. Nulla justo.

Aliquam quis turpis eget elit sodales scelerisque. Mauris sit amet eros. Suspendisse accumsan tortor quis turpis.

Sed ante. Vivamus tortor. Duis mattis egestas metus.",12/16/2015,33441b0b-50db-4c8a-b39f-817784ed60f9,,,true
e2ea7d0d-aaaf-4ab1-9a51-d23d54a04589,1abeb3cd-8da8-4cc3-867f-10716bc168c2,Flowdesk,"Proin leo odio, porttitor id, consequat in, consequat ut, nulla. Sed accumsan felis. Ut at dolor quis odio consequat varius. Integer ac leo. Pellentesque ultrices mattis odio. Donec vitae nisi.","Maecenas leo odio, condimentum id, luctus nec, molestie sed, justo. Pellentesque viverra pede ac diam. Cras pellentesque volutpat dui.

Maecenas tristique, est et tempus semper, est quam pharetra magna, ac consequat metus sapien ut nunc. Vestibulum ante ipsum primis in faucibus orci luctus et ultrices posuere cubilia Curae; Mauris viverra diam vitae quam. Suspendisse potenti.

Nullam porttitor lacus at turpis. Donec posuere metus vitae ipsum. Aliquam non mauris.",11/15/2015,2e33be61-60c5-4f78-b832-74296f6a1a2c,,,true
6ee1693a-6d8c-42b9-9152-38b8841a2f62,04a0aad1-af2b-4a2a-92e0-a811946ece0c,Voltsillam,"Morbi quis tortor id nulla ultrices aliquet. Maecenas leo odio, condimentum id, luctus nec, molestie sed, justo. Pellentesque viverra pede ac diam. Cras pellentesque volutpat dui.","Maecenas leo odio, condimentum id, luctus nec, molestie sed, justo. Pellentesque viverra pede ac diam. Cras pellentesque volutpat dui.

Maecenas tristique, est et tempus semper, est quam pharetra magna, ac consequat metus sapien ut nunc. Vestibulum ante ipsum primis in faucibus orci luctus et ultrices posuere cubilia Curae; Mauris viverra diam vitae quam. Suspendisse potenti.",12/31/2015,0fe54679-8c5b-483e-8621-9f49716af3df,2/10/2016,ead30872-7b74-40f5-872a-585fdcb332f7,true
d2b191a4-efa9-43c1-8b30-1eb8331504a6,051a01ce-80a5-4b69-a885-c6f165468bd4,Mat Lam Tam,"Donec quis orci eget orci vehicula condimentum. Curabitur in libero ut massa volutpat convallis. Morbi odio odio, elementum eu, interdum eu, tincidunt in, leo. Maecenas pulvinar lobortis est. Phasellus sit amet erat.","Quisque porta volutpat erat. Quisque erat eros, viverra eget, congue eget, semper rutrum, nulla. Nunc purus.",10/15/2015,5c6447cb-36e3-45b1-a5f3-b585a445c43e,,,true
